name,activity_date,activity_headline,activity_description,activity_source,activity_url,activity_type,full_text,strategy_insights,leadership_changes,news_presence_score
DNS Capital,2025-01-23,Vermillio Secures $16 Million Funding,"Vermillio, an AI licensing platform, has secured $16 million in series A funding from DNS Capital and Sony Music.",Variety,https://variety.com/2025/music/news/vermillio-sony-music-dns-capital-16-million-funding-1236326448/,fundraising,"Vermillio, an AI licensing and protection platform, has secured $16 million in series A funding from Sony Music and DNS Capital, highlighting strategic partnerships in the tech space.","DNS Capital has focused on partnerships in technology and the industrial sectors over recent years, leveraging its connections for strategic fundraising.",No noted leadership changes in the past 10 years.,8
DNS Capital,2024-11-05,DNS Capital Completes Acquisition of IMI Holding Corp.,"DNS Capital has successfully acquired IMI Holding Corp, expanding its portfolio within the industrial sector.",Magnetics,https://www.magnetics.com/company/whats-up/press-releases/dns-capital-announces-aquisition-of-imi-holding-corp?srsltid=AfmBOorRVcYz6xDSQ_pRV5e5f6WPBgn2hu-2fB_yk1Lk9gkl7MLpiVtX,acquisition,"DNS Capital today announced its acquisition of IMI Holding Corp., strengthening its position in the industrial market sectors.","DNS Capital has focused on partnerships in technology and the industrial sectors over recent years, leveraging its connections for strategic fundraising.",No noted leadership changes in the past 10 years.,8
Beverly Capital,2021-03-03,Beverly Capital Invests in The Eye Health Group,"Beverly Capital has acquired The Eye Health Group, expanding its healthcare portfolio.",Business Wire,https://www.businesswire.com/news/home/20210303005164/en/Beverly-Capital-Invests-in-The-Eye-Health-Group,acquisition,"Beverly Capital, a Los Angeles-based private equity firm, announced today that it has acquired The Eye Health Group, marking a significant addition to its healthcare investments.","Beverly Capital has recently focused on the healthcare sector, showcasing a strategic shift towards essential health services.",No significant leadership changes reported.,6
Promus Holdings,,,,,,,,"Promus Holdings' investment strategy emphasizes technology-focused companies, although recent specifics are not documented.","There have been recent promotions within the firm, reflecting a commitment to internal talent development.",5
APFamily,,,,,,,,APFamily focuses on multi-asset class investment strategies but lacks published detailed recent activities.,No notable leadership changes documented.,2
Gresham Partners,2024-02-15,Gresham Partners Announces Q2 Investment Update,Gresham Partners shared insights from their Q2 investment performance showcasing growth in asset management.,Gresham Partners,https://www.greshampartners.com/insights/gresham-partners-investment-update-q2-2024/,other,"Watch the Q2 2024 Investment Update from Gresham Partners, reflecting on current market conditions and investment strategies.",Gresham Partners continues to emphasize a long-term investment approach targeting lower-middle-market firms across various sectors.,Recent promotions include Irene Zhang as investment director.,7
Chicago Capital,,,,,,,,"Chicago Capital offers customized investment services to clients, focusing on tailored financial advice.",No significant leadership changes noted.,3
